{
  "$schema": "https://json-schema.org/draft/2020-12/schema",
  "$id": "urn:inside-coding-agents:schema:lab-scenario:0.1.0",
  "title": "Inside Coding Agents Lab Scenario",
  "type": "object",
  "additionalProperties": false,
  "required": [
    "schema_version",
    "kind",
    "id",
    "experiment_id",
    "prompt",
    "run_started_at",
    "result_generated_at",
    "repetition_interval_seconds",
    "expected"
  ],
  "properties": {
    "schema_version": { "const": "0.1.0" },
    "kind": { "const": "controlled" },
    "id": { "$ref": "#/$defs/stableId" },
    "experiment_id": { "$ref": "#/$defs/stableId" },
    "prompt": { "type": "string", "minLength": 1 },
    "lesson_id": { "$ref": "#/$defs/stableId" },
    "system_prompt": { "type": "string" },
    "run_started_at": { "type": "string", "format": "date-time" },
    "result_generated_at": { "type": "string", "format": "date-time" },
    "repetition_interval_seconds": { "type": "integer", "minimum": 0 },
    "turns": {
      "type": "array",
      "minItems": 1,
      "items": {
        "type": "object",
        "additionalProperties": false,
        "required": ["content", "stop", "tool_calls"],
        "properties": {
          "content": { "type": "string" },
          "stop": { "type": "boolean" },
          "tool_calls": {
            "type": "array",
            "items": {
              "type": "object",
              "additionalProperties": false,
              "required": ["id", "name", "arguments"],
              "properties": {
                "id": { "type": "string", "minLength": 1 },
                "name": { "$ref": "#/$defs/toolName" },
                "arguments": { "type": "object" }
              }
            }
          }
        }
      }
    },
    "expected": {
      "type": "object",
      "additionalProperties": false,
      "required": ["final_text", "stop_reason", "event_types"],
      "properties": {
        "final_text": { "type": "string" },
        "stop_reason": { "type": "string", "minLength": 1 },
        "event_types": {
          "type": "array",
          "minItems": 1,
          "items": { "type": "string", "minLength": 1 }
        },
        "tool_result": {
          "type": "object",
          "additionalProperties": false,
          "required": ["tool", "path", "content"],
          "properties": {
            "tool": { "$ref": "#/$defs/toolName" },
            "path": { "type": "string", "minLength": 1 },
            "content": { "type": "string" }
          }
        },
        "observations": {
          "type": "array",
          "minItems": 1,
          "items": {
            "type": "object",
            "additionalProperties": false,
            "required": ["event_type", "path", "equals"],
            "properties": {
              "event_type": { "type": "string", "minLength": 1 },
              "occurrence": { "type": "integer", "minimum": 0 },
              "path": {
                "type": "array",
                "minItems": 1,
                "items": { "type": ["string", "integer"] }
              },
              "equals": true
            }
          }
        }
      },
      "oneOf": [
        { "required": ["tool_result"], "not": { "required": ["observations"] } },
        { "required": ["observations"], "not": { "required": ["tool_result"] } }
      ]
    }
  },
  "oneOf": [
    {
      "required": ["system_prompt", "turns"],
      "not": { "required": ["lesson_id"] }
    },
    {
      "required": ["lesson_id"],
      "not": {
        "anyOf": [
          { "required": ["system_prompt"] },
          { "required": ["turns"] }
        ]
      }
    }
  ],
  "$defs": {
    "stableId": {
      "type": "string",
      "pattern": "^[a-z0-9]+(?:-[a-z0-9]+)*$"
    },
    "toolName": {
      "type": "string",
      "pattern": "^[a-z][a-z0-9_]*$"
    }
  }
}
